{
  "cards": [
    {
      "classification": {
        "blocked_surface_modes": [],
        "product_archetype": "unclassified",
        "recommended_surface_modes": [],
        "reference_roles": [],
        "source_surface": "unclassified"
      },
      "do_not_copy": [],
      "evidence": {
        "accessibility": {
          "evidence_refs": [],
          "notes": "Static source evidence cannot prove accessibility.",
          "status": "unverified"
        },
        "desktop": {
          "evidence_refs": [
            "https://peekpaper.com/2026/08/10/nothin"
          ],
          "notes": "Peekpaper desktop capture is present; dimensions=2880x1800; captured_at=2026-08-12T15:02:58.141Z.",
          "status": "observed"
        },
        "interaction": {
          "evidence_refs": [],
          "notes": "Static source evidence cannot prove interaction behavior.",
          "status": "unverified"
        },
        "mobile": {
          "evidence_refs": [
            "https://peekpaper.com/2026/08/10/nothin"
          ],
          "notes": "Peekpaper mobile capture is present; dimensions=2880x1800; captured_at=2026-08-12T15:02:58.141Z.",
          "status": "observed"
        },
        "origin_live": {
          "evidence_refs": [],
          "notes": "Origin runtime has not been audited.",
          "status": "unverified"
        },
        "performance": {
          "evidence_refs": [],
          "notes": "Static source evidence cannot prove performance.",
          "status": "unverified"
        }
      },
      "id": "peekpaper-2026-08-10-nothin",
      "lifecycle": {
        "review_after": null,
        "reviewed_at": null
      },
      "not_suitable_when": [],
      "observations": [],
      "origin": {
        "domain": "noth.in",
        "source_description": "Nothin' is a Paris studio at the intersection of fashion, luxury and tech. Branding, editorial, art direction and AI systems — built so a single idea can become anything.",
        "title": "NOTHIN'",
        "url": "https://noth.in/"
      },
      "project_validation_refs": [],
      "rights": {
        "ai_training": false,
        "assets_redistributed": false,
        "mode": "reference-only",
        "policy_observed_at": "2026-08-17",
        "policy_url": "https://peekpaper.com/robots.txt"
      },
      "schema": "design-craft.visual-reference-card.v1",
      "source": {
        "issue_date": "2026-08-10",
        "observed_at": "2026-08-17",
        "post_url": "https://peekpaper.com/2026/08/10/nothin",
        "provider": "peekpaper",
        "source_sha256": "8efbb970dd8a4865ad4ddf2b615144a84b7759015f1a5e8539577ce89d1eae3a"
      },
      "status": "candidate",
      "transferable_mechanisms": []
    },
    {
      "classification": {
        "blocked_surface_modes": [],
        "product_archetype": "unclassified",
        "recommended_surface_modes": [],
        "reference_roles": [],
        "source_surface": "unclassified"
      },
      "do_not_copy": [],
      "evidence": {
        "accessibility": {
          "evidence_refs": [],
          "notes": "Static source evidence cannot prove accessibility.",
          "status": "unverified"
        },
        "desktop": {
          "evidence_refs": [
            "https://peekpaper.com/2026/08/10/jesperlandberg-com"
          ],
          "notes": "Peekpaper desktop capture is present; dimensions=2880x1800; captured_at=2026-08-12T15:02:02.694Z.",
          "status": "observed"
        },
        "interaction": {
          "evidence_refs": [],
          "notes": "Static source evidence cannot prove interaction behavior.",
          "status": "unverified"
        },
        "mobile": {
          "evidence_refs": [
            "https://peekpaper.com/2026/08/10/jesperlandberg-com"
          ],
          "notes": "Peekpaper mobile capture is present; dimensions=2880x1800; captured_at=2026-08-12T15:02:02.694Z.",
          "status": "observed"
        },
        "origin_live": {
          "evidence_refs": [],
          "notes": "Origin runtime has not been audited.",
          "status": "unverified"
        },
        "performance": {
          "evidence_refs": [],
          "notes": "Static source evidence cannot prove performance.",
          "status": "unverified"
        }
      },
      "id": "peekpaper-2026-08-10-jesperlandberg-com",
      "lifecycle": {
        "review_after": null,
        "reviewed_at": null
      },
      "not_suitable_when": [],
      "observations": [],
      "origin": {
        "domain": "jesperlandberg.com",
        "source_description": "Swedish design engineer building visually rich, motion-driven websites. Two-time Awwwards Independent of the Year (2022 & 2024).",
        "title": "Jesper Landberg",
        "url": "https://jesperlandberg.com/"
      },
      "project_validation_refs": [],
      "rights": {
        "ai_training": false,
        "assets_redistributed": false,
        "mode": "reference-only",
        "policy_observed_at": "2026-08-17",
        "policy_url": "https://peekpaper.com/robots.txt"
      },
      "schema": "design-craft.visual-reference-card.v1",
      "source": {
        "issue_date": "2026-08-10",
        "observed_at": "2026-08-17",
        "post_url": "https://peekpaper.com/2026/08/10/jesperlandberg-com",
        "provider": "peekpaper",
        "source_sha256": "8efbb970dd8a4865ad4ddf2b615144a84b7759015f1a5e8539577ce89d1eae3a"
      },
      "status": "candidate",
      "transferable_mechanisms": []
    },
    {
      "classification": {
        "blocked_surface_modes": [
          "Operate"
        ],
        "product_archetype": "luxury expedition service",
        "recommended_surface_modes": [
          "Persuade",
          "Experience"
        ],
        "reference_roles": [
          "structure",
          "responsive",
          "tone"
        ],
        "source_surface": "immersive luxury travel landing page"
      },
      "do_not_copy": [
        "Do not reuse the expedition imagery, brand marks, copy, or exact oversized typography treatment.",
        "Do not infer film playback, enquiry conversion, accessibility, or performance from static captures."
      ],
      "evidence": {
        "accessibility": {
          "evidence_refs": [],
          "notes": "Static source evidence cannot prove accessibility.",
          "status": "unverified"
        },
        "desktop": {
          "evidence_refs": [
            "https://peekpaper.com/2026/08/10/white-desert"
          ],
          "notes": "Peekpaper desktop capture is present; dimensions=2880x1800; captured_at=2026-08-12T15:01:40.071Z.",
          "status": "observed"
        },
        "interaction": {
          "evidence_refs": [],
          "notes": "Static source evidence cannot prove interaction behavior.",
          "status": "unverified"
        },
        "mobile": {
          "evidence_refs": [
            "https://peekpaper.com/2026/08/10/white-desert"
          ],
          "notes": "Peekpaper mobile capture is present; dimensions=2880x1800; captured_at=2026-08-12T15:01:40.071Z.",
          "status": "observed"
        },
        "origin_live": {
          "evidence_refs": [],
          "notes": "Origin runtime has not been audited.",
          "status": "unverified"
        },
        "performance": {
          "evidence_refs": [],
          "notes": "Static source evidence cannot prove performance.",
          "status": "unverified"
        }
      },
      "id": "peekpaper-2026-08-10-white-desert",
      "lifecycle": {
        "review_after": "2026-11-15",
        "reviewed_at": "2026-08-17"
      },
      "not_suitable_when": [
        "The primary task is dense operation, comparison, or regulated proof rather than emotional discovery."
      ],
      "observations": [
        "Desktop uses full-bleed Antarctic media, a slim split navigation, a small editorial promise, a film action, and an oversized location word.",
        "Mobile reduces navigation to logo, Menu, and Enquire, changes the lead image, and preserves the editorial promise and oversized location cue."
      ],
      "origin": {
        "domain": "white-desert.com",
        "source_description": "White Desert is the world’s leading luxury Antarctic expedition company, offering once-in-a-lifetime journeys to the South Pole and Emperor Penguins",
        "title": "White Desert",
        "url": "https://white-desert.com/"
      },
      "project_validation_refs": [],
      "rights": {
        "ai_training": false,
        "assets_redistributed": false,
        "mode": "reference-only",
        "policy_observed_at": "2026-08-17",
        "policy_url": "https://peekpaper.com/robots.txt"
      },
      "schema": "design-craft.visual-reference-card.v1",
      "source": {
        "issue_date": "2026-08-10",
        "observed_at": "2026-08-17",
        "post_url": "https://peekpaper.com/2026/08/10/white-desert",
        "provider": "peekpaper",
        "source_sha256": "8efbb970dd8a4865ad4ddf2b615144a84b7759015f1a5e8539577ce89d1eae3a"
      },
      "status": "reviewed",
      "transferable_mechanisms": [
        "Use immersive media as the primary proof while keeping the proposition short and legible.",
        "Pair an atmospheric exploration action with a dedicated high-intent enquiry action.",
        "On narrow screens, remove secondary navigation before reducing the core story hierarchy."
      ]
    },
    {
      "classification": {
        "blocked_surface_modes": [],
        "product_archetype": "unclassified",
        "recommended_surface_modes": [],
        "reference_roles": [],
        "source_surface": "unclassified"
      },
      "do_not_copy": [],
      "evidence": {
        "accessibility": {
          "evidence_refs": [],
          "notes": "Static source evidence cannot prove accessibility.",
          "status": "unverified"
        },
        "desktop": {
          "evidence_refs": [
            "https://peekpaper.com/2026/08/10/they-call-me-giulio"
          ],